1;260;;3;;63329;Egelsbach;0;64586;;;;"Oberbergener Bassgeige QbA VDP. Erste Lage Grauburgunder trocken 2015 - Weingut Franz Keller";2;13.99;"Der Oberbergener Bassgeige QbA VDP. Erste Lage Grauburgunder trocken von Weingut Franz Keller betört mit einem dezenten Rebsortenbouquet und einer kräftigen, kristallklaren Burunderfrucht im Mund.Oberbergener Bassgeige QbA VDP. Erste Lage Grauburgunder trocken 2015 - Weingut Franz Keller - Weinart: Weißwein, Land: Deutschland, Allergene, weitere Inhaltsstoffe: enthält Sulfite und Schwefeldioxid, Restzucker ca.  in g/l: 1,10, Gesamtsäure ca.  in g/l: 6,60, Qualitätsklassifikation & Prädikate: VDP.Erste Lage, Q.b.A. Qualitätswein bestimmter Anbaugebiete / Prädikatswein";;;;;;1;1;1;;;;;105;;"3.90 EUR";"lieferbar in 1-2 Tagen";;;4,01131E+12;3;"a:1:{i:0;s:119:""https://cdn.vinello.de/media/image/84/46/3d/franz_keller_oberbergener_bassgeige_grauburgunder_583ef890bc39f_600x600.png"";}";3;1;x1217x;1223;1233;12313;1231233;x1235x;8;1;"2018-04-11 12:40:27";"2019-04-11 12:40:27"
1;260;;3;;63329;Egelsbach;0;64586;;;;"Branciforti dei Bordonaro Chardonnay IGT 2015 - Branciforti";2;6.99;"Der Branciforti dei Bordonaro Chardonnay von Branciforti besticht mit einem herrlich duftigen Bouquet. Ein köstlicher Genuss, mit einem nachhaltigen Geschmackserlebnis! Dieser Weißwein aus Sizilien ist ein Musterbeispiel für sonnenverwöhnte Weißweine aus dem Süden Italiens.Branciforti dei Bordonaro Chardonnay IGT 2015 - Branciforti - Weinart: Weißwein, Land: Italien, Allergene, weitere Inhaltsstoffe: enthält Sulfite, Qualitätsklassifikation & Prädikate: IGT Indicazione Geografica Tipica";;;;;;1;1;1;;;;;105;;"3.90 EUR";"lieferbar in 1-2 Tagen";;;8,00282E+12;4;"a:1:{i:0;s:119:""https://cdn.vinello.de/media/image/dc/c0/44/Branciforti_dei_Bordonaro_Chardonnay_Terre_Sicilia5863a800693d0_600x600.png"";}";4;1;x1217x;1223;1233;12313;1231233;x1235x;9;1;"2018-04-11 12:40:27";"2019-04-11 12:40:27"
1;260;;3;;63329;Egelsbach;0;64586;;;;"Les Meysonniers Crozes-Hermitage 2014 AOC - M. Chapoutier";2;15.49;"Der Les Meysonniers Crozes-Hermitage von M. Chapoutier ist ein sortenreiner Syrah, der aus ökologisch zertifizierten Trauben hergestellt wurde. Dieser herrliche Rotwein von alten Rebstöcken besitzt fruchtige und florale Aromen und ist am Gaumen füllig und rund.Les Meysonniers Crozes-Hermitage 2014 AOC - M. Chapoutier - Weinart: Rotwein, Land: Frankreich, Allergene, weitere Inhaltsstoffe: enthält Sulfite und Schwefeldioxid, Qualitätsklassifikation & Prädikate: AOC Appellation d'Origine Contrôlée";;;;;;1;1;1;;;;;105;;"3.90 EUR";"lieferbar in 1 Tagen";;;3,39118E+12;5;"a:1:{i:0;s:82:""https://cdn.vinello.de/media/image/9e/6b/cc/chapoutier_les_meysonniers_600x600.png"";}";5;1;x1217x;1223;1233;12313;1231233;x1235x;10;1;"2018-04-11 12:40:27";"2019-04-11 12:40:27"
1;260;;3;;63329;Egelsbach;0;64586;;;;"Cardellino Chardonnay Castel Ringberg 2016 DOC - Elena Walch";2;16.49;"Der  Cardellino Chardonnay von  Elena Walch ist ein kräftiger, frischer Klassiker mit reifen, fruchtigen Aromen. Dieser feine Weißwein aus Südtirol wird aus besten Trauben der Lagen Castel Ringberg und Rechtenthal vinifiziert. Genießen Sie den  Cardellino , so der deutsche Name für...Cardellino Chardonnay Castel Ringberg 2016 DOC - Elena Walch - Weinart: Weißwein, Land: Italien, Allergene, weitere Inhaltsstoffe: enthält Sulfite und Schwefeldioxid, Restzucker ca.  in g/l: 2,10, Gesamtsäure ca.  in g/l: 5,60, Qualitätsklassifikation & Prädikate: DOC Denominazione di origine controllata";;;;;;1;1;1;;;;;105;;"3.90 EUR";"lieferbar in 3 Tagen";;;8,00091E+12;6;"a:1:{i:0;s:105:""https://cdn.vinello.de/media/image/48/00/1a/elena_walch_cardellino_chardonnay_castel_ringberg_600x600.png"";}";6;1;x1217x;1223;1233;12313;1231233;x1235x;11;1;"2018-04-11 12:40:27";"2019-04-11 12:40:27"
1;260;;3;;63329;Egelsbach;0;64586;;;;"Ventoux AOC 2014 - Delas";2;7.69;"Der Ventoux von Delas ist eine herrliche Cuvée aus Grenache und Syrah, die mit einem fruchtbetonten Duft begeistert. Am Gaumen wirkt dieser Rotwein von der Rhône herrlich dicht mit reifen, seidigen Tanninen.Ventoux AOC 2014 - Delas - Weinart: Rotwein, Land: Frankreich, Allergene, weitere Inhaltsstoffe: enthält Sulfite und Schwefeldioxid, Restzucker ca.  in g/l: 2,80, Gesamtsäure ca.  in g/l: 5,02, Qualitätsklassifikation & Prädikate: AOC Appellation d'Origine Contrôlée";;;;;;1;1;1;;;;;105;;"3.90 EUR";"lieferbar in 3 Tagen";;;3,35995E+12;7;"a:1:{i:0;s:69:""https://cdn.vinello.de/media/image/3b/33/54/delas_ventoux_600x600.png"";}";7;1;x1217x;1223;1233;12313;1231233;x1235x;12;1;"2018-04-11 12:40:27";"2019-04-11 12:40:27"
1;260;;3;;63329;Egelsbach;0;64586;;;;"Chiaramonte Inzolia Sicilia DOC 2015 - Firriato";2;8.98;"Ein sizilianischer Weißer, reinsortig aus Inzolia, mit einem delikaten Duft nach Kräutern und Blumen. Würzig, frisch und gut strukturiert!Chiaramonte Inzolia Sicilia DOC 2015 - Firriato - Weinart: Weißwein, Land: Italien, Allergene, weitere Inhaltsstoffe: enthält Sulfite und Schwefeldioxid, Qualitätsklassifikation & Prädikate: DOC Denominazione di origine controllata";;;;;;1;1;1;;;;;105;;"3.90 EUR";"lieferbar in 1-2 Tagen";;;8,00282E+12;8;"a:1:{i:0;s:96:""https://cdn.vinello.de/media/image/39/50/52/Chiaramonte_Inzolia_Sicilia_DOC_Firriato_600x600.png"";}";8;1;x1217x;1223;1233;12313;1231233;x1235x;13;1;"2018-04-11 12:40:27";"2019-04-11 12:40:27"
1;260;;3;;63329;Egelsbach;0;64586;;;;"Mentor Barossa Valley 2011 - Peter Lehmann";2;31.89;"Ein reinsortiger Cabernet Sauvignon mit einer vielschichtigen Aromenvielfalt im Bouquet. Festes, feinkörniges Tannin sorgt für ein samtiges Gefühl.Mentor Barossa Valley 2011 - Peter Lehmann - Land: Australien, Allergene, weitere Inhaltsstoffe: enthält Sulfite, Restzucker ca.  in g/l: 2,90, Gesamtsäure ca.  in g/l: 6,00";;;;;;1;1;1;;;;;105;;"3.90 EUR";"lieferbar in 3 Tagen";;;9,31191E+12;9;"a:1:{i:0;s:76:""https://cdn.vinello.de/media/image/14/b1/4f/peter_lehmann_mentor_600x600.png"";}";9;1;x1217x;1223;1233;12313;1231233;x1235x;14;1;"2018-04-11 12:40:27";"2019-04-11 12:40:27"
1;260;;3;;63329;Egelsbach;0;64586;;;;"Pinot Blanc Apogée Traditions 2011 AOC - Vignoble des 2 Lunes";2;12.19;"Ein 100%-iger Pinot Blanc mit intensiv fruchtigen Aromen. Die Balance zwischen Säure und Süße ist perfekt abgestimmt.Pinot Blanc Apogée Traditions 2011 AOC - Vignoble des 2 Lunes - Land: Frankreich, Allergene, weitere Inhaltsstoffe: enthält Sulfite und Schwefeldioxid, Qualitätsklassifikation & Prädikate: AOC Appellation d'Origine Contrôlée";;;;;;1;1;1;;;;;105;;"3.90 EUR";"lieferbar in 1-2 Tagen";;;3,76011E+12;10;"a:1:{i:0;s:96:""https://cdn.vinello.de/media/image/aa/05/08/vignoble-des-2-lunes-apogee5849a8c4bbbb3_600x600.png"";}";10;1;x1217x;1223;1233;12313;1231233;x1235x;15;1;"2018-04-11 12:40:27";"2019-04-11 12:40:27"
1;260;;3;;63329;Egelsbach;0;64586;;;;"Hill & Dale Cabernet Sauvignon/Shiraz 2013 - Stellenzicht";2;7.98;"Eine fruchtige Cuvée mit den charakteristischen Shiraz-Aromen sowie Gewürz- und harmonischen Holznoten. Intensiv und weich!Hill & Dale Cabernet Sauvignon/Shiraz 2013 - Stellenzicht - Weinart: Rotwein, Land: Südafrika, Allergene, weitere Inhaltsstoffe: enthält Sulfite und Schwefeldioxid, Restzucker ca.  in g/l: 0,40, Gesamtsäure ca.  in g/l: 5,70";;;;;;1;1;1;;;;;105;;"3.90 EUR";"lieferbar in 1-2 Tagen";;;6,00111E+12;12;"a:1:{i:0;s:91:""https://cdn.vinello.de/media/image/32/8d/7f/hilldalecabernetshiraz585157dce0d08_600x600.png"";}";12;1;x1217x;1223;1233;12313;1231233;x1235x;16;1;"2018-04-11 12:40:27";"2019-04-11 12:40:27"
1;260;;3;;63329;Egelsbach;0;64586;;;;"Chablis Premier Cru Montée de Tonnerre 2015 AOC - Domaine Servin";2;23.99;"Der Chablis Montée de Tonnerre AOC Premier Cru von Domaine Servin ist ein exzellenter Chablis allererster Güte. Die unglaublich elegante Nase begeistert mit mineralischen Noten, citrischen Nuancen und feinen Anflügen von Wiesenkräutern und Blumen. Am Gaumen ist der Chablis Montée de Tonnerre AOC ...Chablis Premier Cru Montée de Tonnerre 2015 AOC - Domaine Servin - Land: Frankreich, Allergene, weitere Inhaltsstoffe: enthält Sulfite und Schwefeldioxid, Qualitätsklassifikation & Prädikate: AOC Appellation d'Origine Contrôlée";;;;;;1;1;1;;;;;105;;"3.90 EUR";"lieferbar in 1-2 Tagen";;;3,58569E+12;14;"a:1:{i:0;s:119:""https://cdn.vinello.de/media/image/5b/bd/aa/Chablis-Montee-de-Tonnerre-AOC-Premier-Cru-Domaine584a7fca6b3e9_600x600.png"";}";14;1;x1217x;1223;1233;12313;1231233;x1235x;17;1;"2018-04-11 12:40:27";"2019-04-11 12:40:27"
1;260;;3;;63329;Egelsbach;0;64586;;;;"Chianti Classico 2011 DOCG - Casa Vinicola Bartali";2;8.98;"Der  Chianti Classico DOCG  von  Casa Vinicola Bartali  ist einer Melange mit frisch-fruchtigen, intensiven Noten in der Nase. Dem Gaumen schmeichelt dieser trockene Chianti Classico mit angenehm weichen und samtigen Tanninen, beeindruckender Frische und einem mittleren, elega...Chianti Classico 2011 DOCG - Casa Vinicola Bartali - Land: Italien, Allergene, weitere Inhaltsstoffe: enthält Sulfite und Schwefeldioxid, Qualitätsklassifikation & Prädikate: DOCG Denominazione di Origine Controllata e Garantita";;;;;;1;1;1;;;;;105;;"3.90 EUR";"lieferbar in 1-2 Tagen";;;8,00013E+12;16;"a:1:{i:0;s:93:""https://cdn.vinello.de/media/image/38/d2/b4/Bartali_Chianti_Classico584a7ede68453_600x600.png"";}";16;1;x1217x;1223;1233;12313;1231233;x1235x;18;1;"2018-04-11 12:40:27";"2019-04-11 12:40:27"
1;260;;3;;63329;Egelsbach;0;64586;;;;"Castillo de Clavijo Tempranillo Tinto DOCa Rioja 2015 - Criadores de Rioja";2;6.49;"Der Castillo de Clavijo Tempranillo Tinto DOCa Rioja von Criadores de Rioja  überzeugt mit einem fruchtig-würzigen Bouquet und einem saftigen, weichen Gaumen.Castillo de Clavijo Tempranillo Tinto DOCa Rioja 2015 - Criadores de Rioja - Weinart: Rotwein, Land: Spanien, Allergene, weitere Inhaltsstoffe: enthält Sulfite und Schwefeldioxid, Restzucker ca.  in g/l: 1,50, Gesamtsäure ca.  in g/l: 5,10, Qualitätsklassifikation & Prädikate: D.O.C. & D.O.Ca. Denominación de Origen Calificada";;;;;;1;1;1;;;;;105;;"3.90 EUR";"lieferbar in 1-2 Tagen";;;8,43601E+12;18;"a:1:{i:0;s:91:""https://cdn.vinello.de/media/image/ff/5e/8d/criadores_rioja_castillo_clavijo_te_600x600.png"";}";18;1;x1217x;1223;1233;12313;1231233;x1235x;19;1;"2018-04-11 12:40:27";"2019-04-11 12:40:27"
1;260;;3;;63329;Egelsbach;0;64586;;;;"Lacrimarosa Campania IGT 2015 - Azienda Agricola Mastroberardino";2;11.48;"Die Frucht des großartigen Terroirs der Region Kampanien bringt den aromatischen  Lacrimarosa Campania IGT  von  Azienda Agricola Mastroberardino  mit seiner fruchtig-delikaten Nase und dem komplexen, balancierten Gaumen hervor.Lacrimarosa Campania IGT 2015 - Azienda Agricola Mastroberardino - Weinart: Roséwein, Land: Italien, Allergene, weitere Inhaltsstoffe: enthält Sulfite, Restzucker ca.  in g/l: 3,00, Gesamtsäure ca.  in g/l: 6,40, Qualitätsklassifikation & Prädikate: IGT Indicazione Geografica Tipica";;;;;;1;1;1;;;;;105;;"3.90 EUR";"lieferbar in 3 Tagen";;;8,01702E+12;20;"a:1:{i:0;s:83:""https://cdn.vinello.de/media/image/b6/6e/3a/mastroberardino_lacrimarosa_600x600.png"";}";20;1;x1217x;1223;1233;12313;1231233;x1235x;20;1;"2018-04-11 12:40:27";"2019-04-11 12:40:27"
1;260;;3;;63329;Egelsbach;0;64586;;;;"Pyrat X.O. Reserve - Anguilla Rums Ltd";2;38.9;"Der Pyrat XO Reserve ist ein sehr aromatischer, komplexer und weicher Blend aus ausgewählten karibischen Rums, der für mindestens 15 Jahre in Holzfässern lagerte. Das Bukett des Pyrat XO Reserve wird bestimmt von ätherisch-citrischen Noten nach Orangenschale, bitterer Orangenmarmelade, Lemon Curd...Pyrat X.O. Reserve - Anguilla Rums Ltd - Land: Anguilla";;;;;;1;1;1;;;;;105;;"3.90 EUR";"lieferbar in 1-2 Tagen";;;7,21733E+11;24;"a:1:{i:0;s:76:""https://cdn.vinello.de/media/image/a4/e8/99/pyrat-rum-xo-reserve_600x600.png"";}";24;1;x1217x;1223;1233;12313;1231233;x1235x;21;1;"2018-04-11 12:40:27";"2019-04-11 12:40:27"
1;260;;3;;63329;Egelsbach;0;64586;;;;"Château Les Rambauds Bordeaux Supérieur 2014 - Yvon Mau";2;6.99;"Der Château Les Rambauds Cuvée Petit Martinot Bordeaux Supérieur von Yvon Mau  ist eine Cuvée mit einem reichen, vielschichtigen Bouquet. Am Gaumen wirkt er gut strukturiert, vollmundig und fleischig.Château Les Rambauds Bordeaux Supérieur 2014 - Yvon Mau - Weinart: Rotwein, Land: Frankreich, Allergene, weitere Inhaltsstoffe: enthält Sulfite und Schwefeldioxid, Restzucker ca.  in g/l: 0,5, Gesamtsäure ca.  in g/l: 3,4, Qualitätsklassifikation & Prädikate: AOC Appellation d?Origine Contrôlée / AOP Appellation d?Origine Protégée";;;;;;1;1;1;;;;;105;;"3.90 EUR";"lieferbar in 1-2 Tagen";;;3,19237E+12;26;"a:1:{i:0;s:95:""https://cdn.vinello.de/media/image/07/39/e1/mau_chateau_rambauds_bordeaux_superieur_600x600.png"";}";26;1;x1217x;1223;1233;12313;1231233;x1235x;22;1;"2018-04-11 12:40:27";"2019-04-11 12:40:27"
1;260;;3;;63329;Egelsbach;0;64586;;;;"Cap Classique Blanc de Blancs Brut 2010 - Graham Beck";2;22.59;"Ein köstlicher, vielseitiger Schaumwein mit kräftigen, cremigen Aromen und Zitrusanklängen. Aufregendes, fein-cremiges Mousseux und wieder Zitrusfrucht beleben den Gaumen.Cap Classique Blanc de Blancs Brut 2010 - Graham Beck - Weinart: Schaumwein, Land: Südafrika, Allergene, weitere Inhaltsstoffe: enthält Sulfite und Schwefeldioxid, Restzucker ca.  in g/l: 8,84, Gesamtsäure ca.  in g/l: 5,81";;;;;;1;1;1;;;;;105;;"3.90 EUR";"lieferbar in 1-2 Tagen";;;6,00487E+12;27;"a:1:{i:0;s:84:""https://cdn.vinello.de/media/image/g0/06/c4/graham_beck_blanc_des_blancs_600x600.png"";}";27;1;x1217x;1223;1233;12313;1231233;x1235x;23;1;"2018-04-11 12:40:27";"2019-04-11 12:40:27"
1;260;;3;;63329;Egelsbach;0;64586;;;;"Bechtheimer Rosengarten Riesling 2012 Qualitätswein trocken - Dreissigacker";2;39.48;"Ein herrlicher Bio-Riesling mit floralen, aber auch tabakig-erdigen Aromen unterlegt. Sehr fein und weich mit Nachhaltigkeit am Gaumen, Schliff und mit langer, nachtrocknender Art im Finale. Bechtheimer Rosengarten Riesling 2012 Qualitätswein trocken - Dreissigacker - Land: Deutschland, Allergene, weitere Inhaltsstoffe: enthält Sulfite, Qualitätsklassifikation & Prädikate: Q.b.A. Qualitätswein bestimmter Anbaugebiete / Prädikatswein";;;;;;1;1;1;;;;;105;;"3.90 EUR";"lieferbar in 3 Tagen";;;4,03688E+12;30;"a:1:{i:0;s:102:""https://cdn.vinello.de/media/image/8e/55/1c/Riesling_Bechtheimer_Rosengarten_Dreissigacker_600x600.png"";}";30;1;x1217x;1223;1233;12313;1231233;x1235x;24;1;"2018-04-11 12:40:27";"2019-04-11 12:40:27"
1;260;;3;;63329;Egelsbach;0;64586;;;;"Barceló Tempranillo Tinto 2014 - Hijos de Antonio Barceló";2;5.59;"Der  Barceló Tempranillo Tinto  von  Hijos de Antonio Barceló ist eine Cuvée mit einer saftigen Frucht und einer würzigen Aromatik. Er ist vollmundig und geschmeidig am Gaumen.Barceló Tempranillo Tinto 2014 - Hijos de Antonio Barceló - Weinart: Rotwein, Land: Spanien, Allergene, weitere Inhaltsstoffe: enthält Sulfite und Schwefeldioxid, Restzucker ca.  in g/l: 2,00, Gesamtsäure ca.  in g/l: 4,70";;;;;;1;1;1;;;;;105;;"3.90 EUR";"lieferbar in 1-2 Tagen";;;8,41085E+12;31;"a:1:{i:0;s:87:""https://cdn.vinello.de/media/image/82/53/1a/antonio_barcelo_te58415eb79d844_600x600.png"";}";31;1;x1217x;1223;1233;12313;1231233;x1235x;25;1;"2018-04-11 12:40:27";"2019-04-11 12:40:27"
1;260;;3;;63329;Egelsbach;0;64586;;;;"Bechtheimer Geyersberg Riesling 2012 Qualitätswein trocken - Dreissigacker";2;45.68;"Ein aus biologisch-dynamisch angebauten Trauben hergestellter Biowein, der herrlich nach Quitten, grünem Tee und Champagnerbirne duftet. Weinig-saftig und mit enormer Dichte und Spannung - endet in langem Nachhall!Bechtheimer Geyersberg Riesling 2012 Qualitätswein trocken - Dreissigacker - Land: Deutschland, Allergene, weitere Inhaltsstoffe: enthält Sulfite, Qualitätsklassifikation & Prädikate: Q.b.A. Qualitätswein bestimmter Anbaugebiete / Prädikatswein";;;;;;1;1;1;;;;;105;;"3.90 EUR";"lieferbar in 3 Tagen";;;4,03688E+12;41;"a:1:{i:0;s:108:""https://cdn.vinello.de/media/image/40/7d/a3/dreissigacker_bechtheimer_geyersberg_ri582218d0e7bdc_600x600.png"";}";41;1;x1217x;1223;1233;12313;1231233;x1235x;26;1;"2018-04-11 12:40:27";"2019-04-11 12:40:27"
1;260;;3;;63329;Egelsbach;0;64586;;;;"Chardonnay 2010 - Bosco del Merlo";2;6.95;"Dieser rebsortenreine Chardonnay von Bosco del Merlo zeigt sich im Glas in einem leuchtenden Strogelb. Sein Bukett ist gekennzeichnet durch sortentypische Fruchtnoten von Banane und Apfel.Chardonnay 2010 - Bosco del Merlo - Weinart: Weißwein, Land: Italien, Allergene, weitere Inhaltsstoffe: enthält Sulfite und Schwefeldioxid, Restzucker ca.  in g/l: 4,00, Gesamtsäure ca.  in g/l: 5,80";;;;;;1;1;1;;;;;105;;"3.90 EUR";"lieferbar in 3 Tagen";;;8,0063E+12;42;"a:1:{i:0;s:82:""https://cdn.vinello.de/media/image/91/63/ea/bosco_del_merlo_chardonnay_600x600.png"";}";42;1;x1217x;1223;1233;12313;1231233;x1235x;27;1;"2018-04-11 12:40:27";"2019-04-11 12:40:27"
1;260;;3;;63329;Egelsbach;0;64586;;;;"Westhofener Kirchspiel Riesling 2010 Qualitätswein trocken - Dreissigacker";2;42.78;"Ein Bio-Riesling der herbe, getrocknet-pflanzliche, tabakige und erdig-mineralische Zitrusduftnoten mit Apfel- und Steinobstaromen entfaltet. Im Mund kräftig und zudem noch leicht säuerlich. Ein nachhaltiger, schmelziger und trockener Weißwein, der sich nach und nach entfaltet.Westhofener Kirchspiel Riesling 2010 Qualitätswein trocken - Dreissigacker - Land: Deutschland, Allergene, weitere Inhaltsstoffe: enthält Sulfite, Qualitätsklassifikation & Prädikate: Q.b.A. Qualitätswein bestimmter Anbaugebiete / Prädikatswein";;;;;;1;1;1;;;;;105;;"3.90 EUR";"lieferbar in 3 Tagen";;;4,03688E+12;44;"a:1:{i:0;s:101:""https://cdn.vinello.de/media/image/c1/39/5d/Riesling_Westhofener_Kirchspiel_Dreissigacker_600x600.png"";}";44;1;x1217x;1223;1233;12313;1231233;x1235x;28;1;"2018-04-11 12:40:27";"2019-04-11 12:40:27"
1;260;;3;;63329;Egelsbach;0;64586;;;;"Westhofener Kirchspiel Riesling 2012 Qualitätswein trocken - Dreissigacker";2;42.78;"Ein Bio-Riesling der herbe, getrocknet-pflanzliche, tabakige und erdig-mineralische Zitrusduftnoten mit Apfel- und Steinobstaromen entfaltet. Im Mund kräftig und zudem noch leicht säuerlich. Ein nachhaltiger, schmelziger und trockener Weißwein, der sich nach und nach entfaltet.Westhofener Kirchspiel Riesling 2012 Qualitätswein trocken - Dreissigacker - Land: Deutschland, Allergene, weitere Inhaltsstoffe: enthält Sulfite, Qualitätsklassifikation & Prädikate: Q.b.A. Qualitätswein bestimmter Anbaugebiete / Prädikatswein";;;;;;1;1;1;;;;;105;;"3.90 EUR";"lieferbar in 3 Tagen";;;4,03688E+12;45;"a:1:{i:0;s:101:""https://cdn.vinello.de/media/image/c1/39/5d/Riesling_Westhofener_Kirchspiel_Dreissigacker_600x600.png"";}";45;1;x1217x;1223;1233;12313;1231233;x1235x;29;1;"2018-04-11 12:40:27";"2019-04-11 12:40:27"
1;260;;3;;63329;Egelsbach;0;64586;;;;"Westhofener Morstein Riesling 2012 Qualitätswein trocken - Dreissigacker";2;50.99;"Ein Bio-Riesling der nach Hopfen, Kamille, Tee, Birne, Wiesenkräuter und Früchten duftet. Pikant säuerlich, dicht und druckvoll am Gaumen - mit langem Finish!Westhofener Morstein Riesling 2012 Qualitätswein trocken - Dreissigacker - Land: Deutschland, Allergene, weitere Inhaltsstoffe: enthält Sulfite, Qualitätsklassifikation & Prädikate: Q.b.A. Qualitätswein bestimmter Anbaugebiete / Prädikatswein";;;;;;1;1;1;;;;;105;;"3.90 EUR";"lieferbar in 3 Tagen";;;4,03688E+12;49;"a:1:{i:0;s:100:""https://cdn.vinello.de/media/image/f9/cd/46/dreissigacker_westhofener_morstein_ri_qba_tr_600x600.png"";}";49;1;x1217x;1223;1233;12313;1231233;x1235x;30;1;"2018-04-11 12:40:27";"2019-04-11 12:40:27"
1;260;;3;;63329;Egelsbach;0;64586;;;;"Riesling trocken 2014 - Dreissigacker";2;10.98;"Der bio-zertifizierte  Riesling Qualitätswein trocken  von  Dreissigacker ist würzig, frisch und mineralisch mit viel frischer Frucht.Riesling trocken 2014 - Dreissigacker - Weinart: Weißwein, Land: Deutschland, Allergene, weitere Inhaltsstoffe: enthält Sulfite und Schwefeldioxid, Restzucker ca.  in g/l: 4,10, Gesamtsäure ca.  in g/l: 7,90, Qualitätsklassifikation & Prädikate: Q.b.A. Qualitätswein bestimmter Anbaugebiete / Prädikatswein";;;;;;1;1;1;;;;;105;;"3.90 EUR";"lieferbar in 1-2 Tagen";;;4,26037E+12;50;"a:1:{i:0;s:91:""https://cdn.vinello.de/media/image/66/9b/a5/dreissigacker_riesling58a5f13056cfd_600x600.png"";}";50;1;x1217x;1223;1233;12313;1231233;x1235x;31;1;"2018-04-11 12:40:27";"2019-04-11 12:40:27"
1;260;;3;;63329;Egelsbach;0;64586;;;;"Wunderwerk Spätburgunder 2011 Qualitätswein trocken - Dreissigacker";2;28.39;"Dieser zertifizierte Bio-Wein Wunderwerk Spätburgunder versprüht einen Duft nach kühlem Rauch und eindringlicher Beerenfrucht. Im Mund ist er klar und feinsaftig. Im Nachhall sind kühler Rauch und eine zarte Mokkanote spürbar.Wunderwerk Spätburgunder 2011 Qualitätswein trocken - Dreissigacker - Land: Deutschland, Allergene, weitere Inhaltsstoffe: enthält Sulfite, Restzucker ca.  in g/l: 0,10, Gesamtsäure ca.  in g/l: 5,10, Qualitätsklassifikation & Prädikate: Q.b.A. Qualitätswein bestimmter Anbaugebiete / Prädikatswein";;;;;;1;1;1;;;;;105;;"3.90 EUR";"lieferbar in 3 Tagen";;;4,03688E+12;52;"a:1:{i:0;s:95:""https://cdn.vinello.de/media/image/e8/9a/c3/dreissigacker_wunderwerk_pn_qba_trocken_600x600.png"";}";52;1;x1217x;1223;1233;12313;1231233;x1235x;32;1;"2018-04-11 12:40:27";"2019-04-11 12:40:27"
1;260;;3;;63329;Egelsbach;0;64586;;;;"Bechtheimer Hasensprung Riesling 2012 Qualitätswein trocken - Dreissigacker";2;29.79;"Der ökologische Bechtheimer Hasensprung Riesling Qualitätswein trocken von Dreissigacker beeindruckt mit saftigen, gelben Früchten, einer verspielten, feinen Würze und seiner großartigen Länge.Bechtheimer Hasensprung Riesling 2012 Qualitätswein trocken - Dreissigacker - Land: Deutschland, Allergene, weitere Inhaltsstoffe: enthält Ei oder Eiweiß, enthält Milch oder Milcheiweiß, enthält Sulfite und Schwefeldioxid, Restzucker ca.  in g/l: 0,10, Gesamtsäure ca.  in g/l: 5,80, Qualitätsklassifikation & Prädikate: Q.b.A. Qualitätswein bestimmter Anbaugebiete / Prädikatswein";;;;;;1;1;1;;;;;105;;"3.90 EUR";"lieferbar in 1-2 Tagen";;;4,03688E+12;53;"a:1:{i:0;s:85:""https://cdn.vinello.de/media/image/b1/ea/ba/dreissigacker_hasensprung_rie_600x600.png"";}";53;1;x1217x;1223;1233;12313;1231233;x1235x;33;1;"2018-04-11 12:40:27";"2019-04-11 12:40:27"
1;260;;3;;63329;Egelsbach;0;64586;;;;"Bechtheimer Stein Cuvée Beerenauslese 0,375 l 2015 - Dreissigacker";2;15.89;"Der aus biologisch zertifizierten Trauben erzeugte  Bechtheimer Stein Cuvée Beerenauslese  von  Dreissigacker  begeistert mit purer Exotik und konzentrierter Restsüße sowie Harmonie und Länge. Bechtheimer Stein Cuvée Beerenauslese 0,375 l 2015 - Dreissigacker - Land: Deutschland, Allergene, weitere Inhaltsstoffe: enthält Sulfite und Schwefeldioxid, Restzucker ca.  in g/l: 206,80, Gesamtsäure ca.  in g/l: 7,00, Qualitätsklassifikation & Prädikate: Beerenauslese Prädikatswein b.A.";;;;;;1;1;1;;;;;105;;"3.90 EUR";"lieferbar in 1 Tagen";;;4,26037E+12;54;"a:1:{i:0;s:94:""https://cdn.vinello.de/media/image/54/86/5a/dreissigacker_bechtheimer_stein_beeren_600x600.png"";}";54;1;x1217x;1223;1233;12313;1231233;x1235x;34;1;"2018-04-11 12:40:27";"2019-04-11 12:40:27"
1;260;;3;;63329;Egelsbach;0;64586;;;;"Shiraz Benchmark 2014 - Grant Burge";2;7.9;"Der Shiraz Benchmark von Grant Burge macht seinem Namen alle Ehre, denn dieser Shiraz aus Australien setzt wirklich Maßstäbe. Wir sind begeistert, nicht nur was das Preis-Genuss-Verhältnis des Shiraz Benchmark angeht.Shiraz Benchmark 2014 - Grant Burge - Weinart: Rotwein, Land: Australien, Allergene, weitere Inhaltsstoffe: enthält Sulfite und Schwefeldioxid";;;;;;1;1;1;;;;;105;;"3.90 EUR";"lieferbar in 1-2 Tagen";;;9,31571E+12;57;"a:1:{i:0;s:84:""https://cdn.vinello.de/media/image/1d/7e/a4/grant_burge_benchmark_shiraz_600x600.png"";}";57;1;x1217x;1223;1233;12313;1231233;x1235x;35;1;"2018-04-11 12:40:27";"2019-04-11 12:40:27"
1;260;;3;;63329;Egelsbach;0;64586;;;;"Bechtheimer Saint Laurent 2011 Qualitätswein trocken - Dreissigacker";2;10.98;"Der Bio-zertifizierte  Bechtheimer Saint Laurent Qualitätswein trocken  von  Dreissigacker  duftet nach Kirsche und Brombeere. Im Mund entfalten sich Cassis-Noten, schwarzer Pfeffer und subtil Graphit, Leder und Schokolade und etwas Menthol. Elegant!Bechtheimer Saint Laurent 2011 Qualitätswein trocken - Dreissigacker - Land: Deutschland, Allergene, weitere Inhaltsstoffe: enthält Sulfite, Qualitätsklassifikation & Prädikate: Q.b.A. Qualitätswein bestimmter Anbaugebiete / Prädikatswein";;;;;;1;1;1;;;;;105;;"3.90 EUR";"lieferbar in 3 Tagen";;;4,03688E+12;58;"a:1:{i:0;s:88:""https://cdn.vinello.de/media/image/9a/ee/9d/bechtheimer_saint_laurent_qba_tr_600x600.png"";}";58;1;x1217x;1223;1233;12313;1231233;x1235x;36;1;"2018-04-11 12:40:27";"2019-04-11 12:40:27"
1;260;;3;;63329;Egelsbach;0;64586;;;;"Weißburgunder Qualitätswein trocken 1,0 l 2015 - Dreissigacker";2;7.89;"Der  Weißburgunder Qualitätswein trocken  von  Dreissigacker entfaltet einen kühlen mineralischen Duft und eine anregende Frische am Gaumen.Weißburgunder Qualitätswein trocken 1,0 l 2015 - Dreissigacker - Land: Deutschland, Allergene, weitere Inhaltsstoffe: enthält Ei oder Eiweiß, enthält Milch oder Milcheiweiß, enthält Sulfite und Schwefeldioxid, Restzucker ca.  in g/l: 6,80, Gesamtsäure ca.  in g/l: 7,50, Qualitätsklassifikation & Prädikate: Q.b.A. Qualitätswein bestimmter Anbaugebiete / Prädikatswein";;;;;;1;1;1;;;;;105;;"3.90 EUR";"lieferbar in 1 Tagen";;;4,26037E+12;59;"a:1:{i:0;s:87:""https://cdn.vinello.de/media/image/3e/ee/c3/dreissigacker-1l-weissburgunder_600x600.png"";}";59;1;x1217x;1223;1233;12313;1231233;x1235x;37;1;"2018-04-11 12:40:27";"2019-04-11 12:40:27"
